begin,end,begin_segment,end_segment,begin_line,end_line,leftContext,surface,rightContext,entityNum,entityLabel,entityGroup
432,441,Personen.,Personen.,-1,-1," Warwand.          Sylvester,",sein Sohn,", regierender Graf.          ",0,"transfer(""Figurentafel"", audience, child_of(sylvester, sylvius))",false
156173,156215,,,-1,-1,"das Mädchen ihm nicht weigert,",Obschon von ihrer Lieb er noch nichts weiß,".              – Wenn Rupert ",1,"transfer(jeronimus, eustache, !knowledge(sylvester, lover(ottokar, agnes)))",false
40797,40860,,,-1,-1,"          Wie du nur sprichst!","Sie haben dir den Enkel,              Den Bruder mir vergiftet",", und das sollen             ",2,"transfer(agnes, audience, siblings(agnes, ""Phillipp""))",false
234093,234185,,,-1,-1,"            der vor ihr steht.","Wer würde glauben, daß der grobe Mantel              So Zartes deckte, als ein Mädchenleib!",Drück ich dir noch den Helm au,3,"transfer(""Verkleidung"", [audience, ottokar, barnabe], identity(agnes, COSTUME[OTTOKAR]))",false
30919,31119,,Erste Szene,-1,-1,bereilt hast du die Auflösung.,"Nicht wahr, das Mädchen, dessen Schleier hier,              Ist Agnes nicht, nicht Agnes Schroffenstein?                                         JOHANN.            Ich sag dir ja, sie ist es.",OTTOKAR.            O mein Go,4,"transfer(johann, [ottokar, audience], identity(LOVER[OTTOKAR], agnes), suspicion)",false
842,854,Personen.,Personen.,-1,-1,"äberswitwe.          Barnabe,",ihre Tochter,.          Eine Kammerjungfer,5,"transfer(""Figurentafel"", audience, child_of(barnabe, ursula))",false
290,298,Personen.,Personen.,-1,-1,"e Gemahlin.          Ottokar,",ihr Sohn,".          Johann, Ruperts na",6,"transfer(""Figurentafel"", audience, child_of(ottokar, eustache))",false
481,500,Personen.,Personen.,-1,-1,"nder Graf.          Gertrude,",Sylvesters Gemahlin,", Stiefschwester der Eustache.",7,"transfer(""Figurentafel"", audience, spouses(sylvester, gertrude))",false
217445,217484,,,-1,-1,"          Das ist nicht alles.",Rupert              Kennt deine Liebe.,"–                        ",8,"transfer(eustache, ottokar, knowledge(rupert, in_love_with(ottokar, agnes)))",false
97596,97649,,,-1,-1,"hien's fast, wie im Wahnsinn –","sprach              Von Liebe, daß er mich vergöttre",– nannte              Bald ei,9,"transfer(agnes, [sylvester, gertrud, jeronimus], transfer(johann, agnes, in_love_with(johann, agnes)))",false
183785,183807,,,-1,-1,Weg selbst zur Versöhnung dir.,Die Kinder lieben sich,", ich habe sichre            ",10,"transfer(eustache, rupert, lovers(ottokar, agnes))",false
121457,121484,Erste Szene,Erste Szene,-1,-1,"                     AGNES.",Ottokar von Schroffenstein.,"OTTOKAR.                   ",11,"transfer(agnes, [audience, ottokar], knowledge(agnes, identity(LOVER[AGNES], agnes)))",false
116506,116543,Erste Szene,Erste Szene,-1,-1,"                    OTTOKAR.","Ich weiß, daß er dich heftig liebt. –",AGNES.            Mich liebt.,12,"transfer(ottokar, agnes, in_love_with(johann, agnes))",false
249572,249737,,,-1,-1,"                    SYLVIUS.","Das ist nicht Agnes!              – Das wäre Agnes, Knabe? Agnes' Kleid,              Nicht Agnes! Nein bei meinem ew'gen Leben,              Das ist nicht Agnes!","JOHANN            die Leiche ",13,"transfer(sylvius, [johann, sylvester, eustache, rupert, gertrude], identity(COSTUME[AGNES], ottokar))",false
255,269,Personen.,Personen.,-1,-1,"e Rossitz.          Eustache,",seine Gemahlin,".          Ottokar, ihr Sohn.",14,"transfer(""Figurentafel"", audience, spouses(eustache, rupert))",false
318,342,Personen.,Personen.,-1,-1,"r, ihr Sohn.          Johann,",Ruperts natürlicher Sohn,".          Sylvius, Graf von ",15,"transfer(""Figurentafel"", auidence, child_of(johann, rupert))",false
251499,251523,,,-1,-1,"              Lustig, Alter!",Sie ist's! 's ist Agnes!,"SYLVESTER            bedeckt ",16,"transfer(johann, [sylvius, sylvester, eustache, gertrude], identity(COSTUME[OTTOKAR], agnes))",false
93286,93328,,,-1,-1,"                     AGNES.","Errettet mich,              Ihr Heiligen!","JOHANN.                    ",17,"transfer(agnes, [audience, johann], !in_love_with(agnes, johann))",false
502,529,Personen.,Personen.,-1,-1,"Gertrude, Sylvesters Gemahlin,",Stiefschwester der Eustache,".          Agnes, ihre Tochte",18,"transfer(""Figurentafel"", audience, stepsiblings(gertrude, eustache))",false
4437,4463,Erste Szene,Erste Szene,-1,-1,"                     RUPERT.",Und Mutter auch des Toten.,"EUSTACHE.            O Gott! ",19,"transfer(rupert, audience, child_of(CHILD[EUSTACHE], eustache))",false
69576,69582,,,-1,-1,"                    OTTOKAR.",Maria!,"Willst du nicht besser von   ",20,"transfer(ottokar, audience, has_name(agnes, ""Maria""))",false
121201,121233,Erste Szene,Erste Szene,-1,-1,"                    OTTOKAR.","Nun, ich will's nicht leugnen. –",AGNES.            Wahrhaftig?,21,"transfer(ottokar, [audience, agnes], knowledge(ottokar, identity(LOVER[OTTOKAR, agnes)))",false
548,560,Personen.,Personen.,-1,-1,"der Eustache.          Agnes,",ihre Tochter,.          Jeronimus von Schr,22,"transfer(""Figurentafel"", auidence, child_of(agnes, gertrude))",false
154150,154192,Zweite Szene,Zweite Szene,-1,-1,"                  JERONIMUS.","Ei, daß sie sich so treu wie Engel lieben.","EUSTACHE.            Wie? Du ",23,"transfer(jeronimus, eustache, transfer(johann, jeronimus, lovers(ottokar, agnes)))",false
234447,234530,Erste Szene,Erste Szene,-1,-1,ie kommen! Ritter! Sie kommen!,"Ottokar wirft schnell Agnes' Oberkleid über, und setzt ihren Hut              auf.",AGNES.            Wer soll de,24,"transfer(""Verkleidung"", [audience, barnabe, agnes], identity(ottokar, COSTUME[AGNES]))",false
51551,51572,,,-1,-1,"n,              Dir wegen des",an seinem Sohne Peter,Verübten Mords den Frieden auf,25,"transfer(aldoebern, audience, child_of(""Peter"", rupert))",false
102024,102094,,,-1,-1,"             Weiß nur so viel,","daß sein Namen              Johann, und er ein unecht Kind des Rupert",",              – Daß er den R",26,"transfer(jeronimus, [sylvester, gertrud, agnes], child_of(johann, rupert))",false
548,560,Personen.,Personen.,-1,-1,"der Eustache.          Agnes,",ihre Tochter,.          Jeronimus von Schr,27,"transfer(""Figurentafel"", audience, child_of(agnes, sylvester))",false
92025,92039,,,-1,-1,"   Es folgt dir ja kein Feind,",ich liebe dich,",              Ach, lieben! I",28,"transfer(johann, agnes, in_love_with(johann, agnes))",false
67205,67267,,,-1,-1,"chts Böses bin ich mir bewußt,",ich fühle              Du gehst mir über alles Glück der Welt,Und nicht ans Leben bin ich so,29,"transfer(ottokar, [audience, agnes], in_love_with(ottokar, agnes))",false
32634,32914,,,-1,-1,"                  JERONIMUS.","Ich weiß, was dich so zäh macht in dem Argwohn.              's ist wahr, und niemals werd ich's leugnen, ja,              Ich hatt das Mädel mir zum Weib erkoren.              Doch eh ich je mit Mördern mich verschwägre,              Zerbreche mir die Henkershand das Wappen.",OTTOKAR            fällt Jero,30,"transfer(jeronimus, [ottokar, audience], !in_love_with(jeronimus, agnes))",false
7579,7589,,,-1,-1,"o, meinst du, soll ich warten,",Peters Tod,"Nicht rächen, bis ich Ottokars",31,"transfer(rupert, audience, has_name(CHILD[EUSTACHE], ""Peter""))",false
123641,123700,,,-1,-1,"                     AGNES.","Ganz deine, in der grenzenlosesten              Bedeutung.","OTTOKAR.                   ",32,"transfer(agnes, [ottokar, audience], in_love_with(agnes, ottokar))",false
290,298,Personen.,Personen.,-1,-1,"e Gemahlin.          Ottokar,",ihr Sohn,".          Johann, Ruperts na",33,"transfer(""Figurentafel"", audience, child_of(ottokar, rupert))",false
197835,197843,Dritte Szene,Dritte Szene,-1,-1,"                    BARNABE.",Barnabe.,"OTTOKAR.                   ",34,"transfer(barnabe, ottokar, has_name(HEXE, barnabe))",false
75041,75078,,,-1,-1,"te dein Gemüt so häßlich sein,","Da du doch Agnes, Agnes lieben kannst","!                        ",35,"transfer(ottokar, audience, in_love_with(johann, agnes))",false
